{
  "pcb_length": 65.0,
  "pcb_width": 30.0,
  "pcb_thickness": 1.4,
  "pcb_corner_radius": 3.0,
  "mount_pitch_x": 58.0,
  "mount_pitch_y": 23.0,
  "mount_edge_offset": 3.5,
  "mount_hole_diameter": 2.75,
  "pcb_clearance": 0.8,
  "wall_thickness": 2.0,
  "floor_thickness": 2.0,
  "base_height": 11.5,
  "outer_corner_radius": 4.0,
  "standoff_diameter": 5.2,
  "standoff_height": 2.2,
  "locating_pin_diameter": 2.35,
  "lid_top_thickness": 2.0,
  "lid_skirt_depth": 4.5,
  "lid_skirt_thickness": 1.8,
  "lid_fit_clearance": 0.2,
  "snap_ridge_height": 1.0,
  "snap_ridge_depth": 0.7,
  "snap_bead_depth": 0.85,
  "power_usb_center_x": -20.1,
  "data_usb_center_x": 8.9,
  "usb_opening_width": 9.0,
  "usb_opening_height": 4.2,
  "usb_opening_z": 4.0,
  "hdmi_center_x": 21.5,
  "hdmi_opening_width": 8.5,
  "hdmi_opening_height": 4.0,
  "hdmi_opening_z": 4.0,
  "sd_opening_width": 14.0,
  "sd_opening_height": 2.4,
  "sd_opening_z": 3.8,
  "csi_opening_width": 18.0,
  "csi_opening_height": 2.0,
  "csi_opening_z": 5.2,
  "gpio_slot_center_x": 0.0,
  "gpio_slot_center_y": 11.5,
  "gpio_slot_length": 52.0,
  "gpio_slot_width": 6.5,
  "soc_center_x": -3.5,
  "soc_center_y": 0.0,
  "vent_hole_diameter": 2.4,
  "vent_pitch": 4.2
}
